{"acknowledgment_status":"not-recorded-in-computational-receipt","algorithm_version":"week9-shared-noise-calibration-v1:selection-algorithm-v1","analysis_sha256":"4e7f2aba7eacb2852596e4f01b2cae2fcf723ee4df283b37d0cf82f6ed34bcc9","candidates":[{"beneficial":10,"condition":"s010","discordant_devices":6,"discordant_groups":3,"group_benefits":[0.0,0.025,0.008333333333333333,0.025],"group_statistics":{"w9c-p000":{"benefit":0.0,"majority_failures":0,"majority_frr":0.0,"n":120,"outcomes":{"majority-3-v1":{"C":120,"D":0,"I":0,"W":0},"single-read-v1":{"C":120,"D":0,"I":0,"W":0}},"single_failures":0,"single_frr":0.0},"w9c-p001":{"benefit":0.025,"majority_failures":0,"majority_frr":0.0,"n":120,"outcomes":{"majority-3-v1":{"C":120,"D":0,"I":0,"W":0},"single-read-v1":{"C":117,"D":3,"I":0,"W":0}},"single_failures":3,"single_frr":0.025},"w9c-p002":{"benefit":0.008333333333333333,"majority_failures":2,"majority_frr":0.016666666666666666,"n":120,"outcomes":{"majority-3-v1":{"C":118,"D":2,"I":0,"W":0},"single-read-v1":{"C":117,"D":3,"I":0,"W":0}},"single_failures":3,"single_frr":0.025},"w9c-p003":{"benefit":0.025,"majority_failures":2,"majority_frr":0.016666666666666666,"n":120,"outcomes":{"majority-3-v1":{"C":118,"D":2,"I":0,"W":0},"single-read-v1":{"C":115,"D":5,"I":0,"W":0}},"single_failures":5,"single_frr":0.041666666666666664}},"harmful":3,"intervals":{"delta":{"defined_resamples":10000,"degenerate":false,"estimate":0.014583333333333335,"lower":0.0020833333333333294,"unseen_events_limitation":false,"upper":0.02921874999999925},"majority_frr":{"defined_resamples":10000,"degenerate":false,"estimate":0.008333333333333333,"lower":0.0020833333333333333,"unseen_events_limitation":false,"upper":0.016666666666666666},"single_frr":{"defined_resamples":10000,"degenerate":false,"estimate":0.02291666666666667,"lower":0.0062499999999999995,"unseen_events_limitation":false,"upper":0.043750000000000004}},"leave_one_device_out":[0.015217391304347827,0.015217391304347827,0.015217391304347827,0.015217391304347827,0.015217391304347827,0.015217391304347827,0.010869565217391304,0.015217391304347827,0.015217391304347827,0.015217391304347827,0.015217391304347827,0.013043478260869565,0.010869565217391304,0.015217391304347827,0.015217391304347827,0.015217391304347827,0.017391304347826087,0.015217391304347827,0.015217391304347827,0.015217391304347827,0.015217391304347827,0.010869565217391304,0.015217391304347827,0.013043478260869565],"leave_one_group_out":[0.019444444444444445,0.011111111111111112,0.016666666666666666,0.011111111111111112],"majority_failures":4,"n":480,"outcomes":{"majority-3-v1":{"C":476,"D":4,"I":0,"W":0},"single-read-v1":{"C":469,"D":11,"I":0,"W":0}},"sigma":0.1,"single_failure_devices":5,"single_failure_groups":3,"single_failures":11},{"beneficial":40,"condition":"s015","discordant_devices":14,"discordant_groups":4,"group_benefits":[0.03333333333333333,0.125,0.06666666666666667,0.058333333333333334],"group_statistics":{"w9c-p000":{"benefit":0.03333333333333333,"majority_failures":1,"majority_frr":0.008333333333333333,"n":120,"outcomes":{"majority-3-v1":{"C":119,"D":0,"I":1,"W":0},"single-read-v1":{"C":115,"D":5,"I":0,"W":0}},"single_failures":5,"single_frr":0.041666666666666664},"w9c-p001":{"benefit":0.125,"majority_failures":5,"majority_frr":0.041666666666666664,"n":120,"outcomes":{"majority-3-v1":{"C":115,"D":5,"I":0,"W":0},"single-read-v1":{"C":100,"D":19,"I":1,"W":0}},"single_failures":20,"single_frr":0.16666666666666666},"w9c-p002":{"benefit":0.06666666666666667,"majority_failures":4,"majority_frr":0.03333333333333333,"n":120,"outcomes":{"majority-3-v1":{"C":116,"D":4,"I":0,"W":0},"single-read-v1":{"C":108,"D":12,"I":0,"W":0}},"single_failures":12,"single_frr":0.1},"w9c-p003":{"benefit":0.058333333333333334,"majority_failures":5,"majority_frr":0.041666666666666664,"n":120,"outcomes":{"majority-3-v1":{"C":115,"D":4,"I":0,"W":1},"single-read-v1":{"C":108,"D":12,"I":0,"W":0}},"single_failures":12,"single_frr":0.1}},"harmful":6,"intervals":{"delta":{"defined_resamples":10000,"degenerate":false,"estimate":0.07083333333333335,"lower":0.03333333333333334,"unseen_events_limitation":false,"upper":0.1125},"majority_frr":{"defined_resamples":10000,"degenerate":false,"estimate":0.03125,"lower":0.012499999999999999,"unseen_events_limitation":false,"upper":0.05416666666666667},"single_frr":{"defined_resamples":10000,"degenerate":false,"estimate":0.10208333333333335,"lower":0.05416666666666667,"unseen_events_limitation":false,"upper":0.15625}},"leave_one_device_out":[0.07391304347826087,0.07173913043478261,0.07391304347826087,0.07391304347826087,0.07391304347826087,0.06739130434782609,0.058695652173913045,0.06956521739130435,0.07391304347826087,0.06521739130434782,0.07391304347826087,0.06956521739130435,0.06739130434782609,0.07391304347826087,0.07173913043478261,0.06956521739130435,0.06956521739130435,0.07391304347826087,0.06956521739130435,0.07391304347826087,0.07391304347826087,0.07608695652173914,0.07391304347826087,0.06086956521739131],"leave_one_group_out":[0.08333333333333333,0.05277777777777778,0.07222222222222222,0.075],"majority_failures":15,"n":480,"outcomes":{"majority-3-v1":{"C":465,"D":13,"I":1,"W":1},"single-read-v1":{"C":431,"D":48,"I":1,"W":0}},"sigma":0.15,"single_failure_devices":14,"single_failure_groups":4,"single_failures":49},{"beneficial":90,"condition":"s020","discordant_devices":20,"discordant_groups":4,"group_benefits":[0.1,0.16666666666666666,0.24166666666666667,0.19166666666666668],"group_statistics":{"w9c-p000":{"benefit":0.1,"majority_failures":2,"majority_frr":0.016666666666666666,"n":120,"outcomes":{"majority-3-v1":{"C":118,"D":2,"I":0,"W":0},"single-read-v1":{"C":106,"D":13,"I":0,"W":1}},"single_failures":14,"single_frr":0.11666666666666667},"w9c-p001":{"benefit":0.16666666666666666,"majority_failures":10,"majority_frr":0.08333333333333333,"n":120,"outcomes":{"majority-3-v1":{"C":110,"D":10,"I":0,"W":0},"single-read-v1":{"C":90,"D":28,"I":2,"W":0}},"single_failures":30,"single_frr":0.25},"w9c-p002":{"benefit":0.24166666666666667,"majority_failures":10,"majority_frr":0.08333333333333333,"n":120,"outcomes":{"majority-3-v1":{"C":110,"D":10,"I":0,"W":0},"single-read-v1":{"C":81,"D":37,"I":2,"W":0}},"single_failures":39,"single_frr":0.325},"w9c-p003":{"benefit":0.19166666666666668,"majority_failures":12,"majority_frr":0.1,"n":120,"outcomes":{"majority-3-v1":{"C":108,"D":12,"I":0,"W":0},"single-read-v1":{"C":85,"D":32,"I":2,"W":1}},"single_failures":35,"single_frr":0.2916666666666667}},"harmful":6,"intervals":{"delta":{"defined_resamples":10000,"degenerate":false,"estimate":0.17500000000000002,"lower":0.11666666666666667,"unseen_events_limitation":false,"upper":0.2333333333333334},"majority_frr":{"defined_resamples":10000,"degenerate":false,"estimate":0.07083333333333333,"lower":0.03125,"unseen_events_limitation":false,"upper":0.11458333333333333},"single_frr":{"defined_resamples":10000,"degenerate":false,"estimate":0.24583333333333335,"lower":0.16041666666666668,"unseen_events_limitation":false,"upper":0.33958333333333335}},"leave_one_device_out":[0.1826086956521739,0.18043478260869567,0.1782608695652174,0.18043478260869567,0.17391304347826086,0.17391304347826086,0.1608695652173913,0.18043478260869567,0.1826086956521739,0.17391304347826086,0.1782608695652174,0.17608695652173914,0.17391304347826086,0.1826086956521739,0.1673913043478261,0.1673913043478261,0.16304347826086957,0.1782608695652174,0.16956521739130434,0.1826086956521739,0.18043478260869567,0.16956521739130434,0.17608695652173914,0.1673913043478261],"leave_one_group_out":[0.2,0.17777777777777778,0.1527777777777778,0.16944444444444445],"majority_failures":34,"n":480,"outcomes":{"majority-3-v1":{"C":446,"D":34,"I":0,"W":0},"single-read-v1":{"C":362,"D":110,"I":6,"W":2}},"sigma":0.2,"single_failure_devices":20,"single_failure_groups":4,"single_failures":118},{"beneficial":116,"condition":"s025","discordant_devices":23,"discordant_groups":4,"group_benefits":[0.15,0.25833333333333336,0.2916666666666667,0.21666666666666667],"group_statistics":{"w9c-p000":{"benefit":0.15,"majority_failures":3,"majority_frr":0.025,"n":120,"outcomes":{"majority-3-v1":{"C":117,"D":3,"I":0,"W":0},"single-read-v1":{"C":99,"D":21,"I":0,"W":0}},"single_failures":21,"single_frr":0.175},"w9c-p001":{"benefit":0.25833333333333336,"majority_failures":29,"majority_frr":0.24166666666666667,"n":120,"outcomes":{"majority-3-v1":{"C":91,"D":29,"I":0,"W":0},"single-read-v1":{"C":60,"D":60,"I":0,"W":0}},"single_failures":60,"single_frr":0.5},"w9c-p002":{"benefit":0.2916666666666667,"majority_failures":11,"majority_frr":0.09166666666666666,"n":120,"outcomes":{"majority-3-v1":{"C":109,"D":11,"I":0,"W":0},"single-read-v1":{"C":74,"D":45,"I":1,"W":0}},"single_failures":46,"single_frr":0.38333333333333336},"w9c-p003":{"benefit":0.21666666666666667,"majority_failures":22,"majority_frr":0.18333333333333332,"n":120,"outcomes":{"majority-3-v1":{"C":98,"D":22,"I":0,"W":0},"single-read-v1":{"C":72,"D":47,"I":0,"W":1}},"single_failures":48,"single_frr":0.4}},"harmful":6,"intervals":{"delta":{"defined_resamples":10000,"degenerate":false,"estimate":0.22916666666666666,"lower":0.17500000000000004,"unseen_events_limitation":false,"upper":0.2833333333333333},"majority_frr":{"defined_resamples":10000,"degenerate":false,"estimate":0.13541666666666666,"lower":0.07291666666666667,"unseen_events_limitation":false,"upper":0.2041666666666667},"single_frr":{"defined_resamples":10000,"degenerate":false,"estimate":0.3645833333333333,"lower":0.26666666666666666,"unseen_events_limitation":false,"upper":0.46249999999999997}},"leave_one_device_out":[0.23695652173913043,0.22608695652173913,0.23695652173913043,0.23043478260869565,0.23695652173913043,0.22826086956521738,0.2326086956521739,0.22826086956521738,0.22826086956521738,0.23043478260869565,0.22826086956521738,0.21956521739130436,0.21956521739130436,0.2391304347826087,0.22608695652173913,0.2217391304347826,0.21739130434782608,0.23478260869565218,0.23043478260869565,0.23